{"admission_contract":{"actual_json_schema_validation":true,"boolean_only_claim_sufficient":false,"clean_release_provenance_required":true,"closed_role_schema_registry":true,"exact_artifact_bytes_rehashed":true,"fixed_worker_snapshot":true,"generic_payload_sufficient":false,"pinned_schema_bytes":true,"self_selected_trust_root":false,"streaming_raw_verification":true,"synthetic_resolves_checked_in_state":false,"typed_result_required":true},"bindings":{"config__schemas__calibration-freeze-v1_schema_json":{"path":"config/schemas/calibration-freeze-v1.schema.json","sha256":"6df305794c07136336ebbd2aae44270289041f6c42bb62e205459a2eb3e7f07b","size_bytes":2642},"config__schemas__hardware-prefetch-qualification-v1_schema_json":{"path":"config/schemas/hardware-prefetch-qualification-v1.schema.json","sha256":"97d2234428fd706f3b99a2a4c5ee326118aaed13608a6c0016f592ea450c825b","size_bytes":2908},"config__schemas__phase-integrity-report-v2_schema_json":{"path":"config/schemas/phase-integrity-report-v2.schema.json","sha256":"523e61d0a89e2f74b3d78a228ec7695a3bc2340ad17c11e2793d406ed4d54044","size_bytes":2184},"config__schemas__phase18-access-transition-v4_schema_json":{"path":"config/schemas/phase18-access-transition-v4.schema.json","sha256":"906ea2e6238b37c07e7a8ac907bc400493ef6ff7052eb8295419c78a3ed0618f","size_bytes":1557},"config__schemas__phase18-authorization-v4_schema_json":{"path":"config/schemas/phase18-authorization-v4.schema.json","sha256":"e41ad6e7df9f25e3689a1832447ceef27d0f2bdf8e669f6929b67d77f40e01f5","size_bytes":1740},"config__schemas__phase18-external-trust-anchor-v4_schema_json":{"path":"config/schemas/phase18-external-trust-anchor-v4.schema.json","sha256":"cd32655f3032e0e08c72d6d6555e6d73632c3729c3ec60223870e6583fb7605a","size_bytes":1457},"config__schemas__phase18-readiness-v4_schema_json":{"path":"config/schemas/phase18-readiness-v4.schema.json","sha256":"b4b8e76b5102e640b695d63c7c7084feac4574ed9b075b6b6bf35975a9317036","size_bytes":1235},"config__schemas__qualification-evidence-v1_schema_json":{"path":"config/schemas/qualification-evidence-v1.schema.json","sha256":"4ce8deabd7091fb9b8ccdc2a5386a564678dec88e2f35fd90f8deeff8beb626e","size_bytes":9060},"config__schemas__runner-admission-v4_schema_json":{"path":"config/schemas/runner-admission-v4.schema.json","sha256":"ae7f4d08c867a1553c3bb3933ca142dc075e4118c543996268ba2192d137ce22","size_bytes":3172},"config__schemas__stage17-calibration-hardware-state-v1_schema_json":{"path":"config/schemas/stage17-calibration-hardware-state-v1.schema.json","sha256":"bb75eb926ae7ae58743969b054c4f4c97e2f4931efbe0e618059f0589d359e9f","size_bytes":1432},"config__schemas__stage17-completion-v4_schema_json":{"path":"config/schemas/stage17-completion-v4.schema.json","sha256":"5e942dbad0e7c96a44dea88c20b0472016e3885984867a577a30feba3c85b52d","size_bytes":2239},"config__schemas__stage17-external-custody-receipt-v2_schema_json":{"path":"config/schemas/stage17-external-custody-receipt-v2.schema.json","sha256":"81f25887cfb07acfb03989c5960444bef8e2961c8f1037a28ab5b0685dde33d6","size_bytes":1863},"config__schemas__stage17-fixed-action-context-v4_schema_json":{"path":"config/schemas/stage17-fixed-action-context-v4.schema.json","sha256":"62d4b27d3fb892c7643a7ab7eb85b785af01e6e14e129e53688fc4064eb6f099","size_bytes":2600},"config__schemas__stage17-fixed-action-request-v4_schema_json":{"path":"config/schemas/stage17-fixed-action-request-v4.schema.json","sha256":"0442f4539ad6a65ebe13b16cedb1179e8a8e60f4b375f1cf3f6c8dbc3743f3f4","size_bytes":5640},"config__schemas__stage17-fixed-phase-actions-v4_schema_json":{"path":"config/schemas/stage17-fixed-phase-actions-v4.schema.json","sha256":"231a3ca99829369023b13354e6336f7d07bce5d70761abbaa6890a909b385723","size_bytes":9557},"config__schemas__stage17-join-audit-v3_schema_json":{"path":"config/schemas/stage17-join-audit-v3.schema.json","sha256":"66748b47e538e7be1368f9071f1ce48f1507a92212cdddbaccf889b65cb06d73","size_bytes":1033},"config__schemas__stage17-operational-artifact-v4_schema_json":{"path":"config/schemas/stage17-operational-artifact-v4.schema.json","sha256":"d848852bac5af5aac4aad4e0c7043ebe1a70db3e553b3b3d3f71a56210969192","size_bytes":6168},"config__schemas__stage17-operational-evidence-admission-policy-v14_schema_json":{"path":"config/schemas/stage17-operational-evidence-admission-policy-v14.schema.json","sha256":"deeb5f55452c965d2c060e72e1a787654415feca33796fdd26a93182ff35b904","size_bytes":2982},"config__schemas__stage17-operational-evidence-admission-policy-v15_schema_json":{"path":"config/schemas/stage17-operational-evidence-admission-policy-v15.schema.json","sha256":"5715f525618945ba9774675f84fd8f9917e34ccc4aa9564eecd6e032d5f90e4c","size_bytes":2985},"config__schemas__stage17-operational-evidence-admission-policy-v16_schema_json":{"path":"config/schemas/stage17-operational-evidence-admission-policy-v16.schema.json","sha256":"de3ad2e54bd4dd7d432aedc58d710d781e6178cc46dbbca089d4cd1fa6aaf402","size_bytes":2978},"config__schemas__stage17-operational-evidence-envelope-v11_schema_json":{"path":"config/schemas/stage17-operational-evidence-envelope-v11.schema.json","sha256":"56d63c61c7d27c43b87944ccd3018acdefad58c7f625af68c6d9d5da9bdedaa8","size_bytes":1972},"config__schemas__stage17-operational-input-manifest-v4_schema_json":{"path":"config/schemas/stage17-operational-input-manifest-v4.schema.json","sha256":"e5a69ae9401b8b48bdc18f66590beae4c64164936ba05f9656fc873719d8ce53","size_bytes":1231},"config__schemas__stage17-operational-typed-record-v4_schema_json":{"path":"config/schemas/stage17-operational-typed-record-v4.schema.json","sha256":"b5b98268ac96876a35131170c9f8ae2c1777939a4b5115aebd4fab0229f5b609","size_bytes":1779},"config__schemas__stage17-page-residency-v3_schema_json":{"path":"config/schemas/stage17-page-residency-v3.schema.json","sha256":"8cb7ed20f5c581a98c9ed697293ebe08d11ce001d843d8a88a5cb2fd256eca95","size_bytes":1025},"config__schemas__stage17-phase-action-attempt-v4_schema_json":{"path":"config/schemas/stage17-phase-action-attempt-v4.schema.json","sha256":"412a723364ca25bd8da35e41bdf8a463f673d9e44d2823d318ee0adbe46946c7","size_bytes":1427},"config__schemas__stage17-phase-action-authorization-v4_schema_json":{"path":"config/schemas/stage17-phase-action-authorization-v4.schema.json","sha256":"1b9fbe2a1578db738eb2e0b8decb67471112a53ba110a797ebc1c205fac477bf","size_bytes":7844},"config__schemas__stage17-phase-action-completion-v4_schema_json":{"path":"config/schemas/stage17-phase-action-completion-v4.schema.json","sha256":"5d433b6744df84ee917a71ab8b209e4fb6496531f7e295ea23ddc739d8b71a72","size_bytes":2160},"config__schemas__stage17-phase-action-failure-v4_schema_json":{"path":"config/schemas/stage17-phase-action-failure-v4.schema.json","sha256":"ddfb190390700b6dc4cbeab5d3db8d1fb14fc5204142a06f9a7778c1c75b8c2f","size_bytes":2158},"config__schemas__stage17-phase-action-result-v4_schema_json":{"path":"config/schemas/stage17-phase-action-result-v4.schema.json","sha256":"f427b3ad11cb78be664799c46a2f2cccd630301fc9dcc328b32ff93bfa763e56","size_bytes":2389},"config__schemas__stage17-pilot-candidate-external-contract-v4_schema_json":{"path":"config/schemas/stage17-pilot-candidate-external-contract-v4.schema.json","sha256":"2ed62f8fb3c74889fac84b1fa38cb6185bcbe1123a8f3b109e5835d651ce510f","size_bytes":3088},"config__schemas__stage17-pilot-hardware-state-v2_schema_json":{"path":"config/schemas/stage17-pilot-hardware-state-v2.schema.json","sha256":"10c60dfc8732e821a128a294accf26f23f62c3df58de863899b8415f8e02a05c","size_bytes":1373},"config__schemas__stage17-pilot-plan-v4_schema_json":{"path":"config/schemas/stage17-pilot-plan-v4.schema.json","sha256":"0baae0340b9882c370289b632215cd145c8a565a7a1f09c0c81f45501f41991c","size_bytes":10447},"config__schemas__stage17-pilot-run-attempt-v1_schema_json":{"path":"config/schemas/stage17-pilot-run-attempt-v1.schema.json","sha256":"5299c0af268b403057c4c3b4357294b728a2ec42ebaa5278e44530e18d9c86d8","size_bytes":1420},"config__schemas__stage17-pilot-run-completion-v1_schema_json":{"path":"config/schemas/stage17-pilot-run-completion-v1.schema.json","sha256":"df6dee1bdf5fc1a31f1d63b4f046eca5f38a328eaafdad3a109fdfcf72aabc96","size_bytes":1553},"config__schemas__stage17-pilot-run-failure-v1_schema_json":{"path":"config/schemas/stage17-pilot-run-failure-v1.schema.json","sha256":"3cc3dbee33c81f22c1f99d3cbaf0dd8af2feb735e93fc126de62533f92619f33","size_bytes":1658},"config__schemas__stage17-pilot-session-completion-v1_schema_json":{"path":"config/schemas/stage17-pilot-session-completion-v1.schema.json","sha256":"9bf5ad7b7db5533c2f87484dd624230c9ab981f936a936d363ab6867984ac19f","size_bytes":2151},"config__schemas__stage17-preflight-pre-marker-blocker-v1_schema_json":{"path":"config/schemas/stage17-preflight-pre-marker-blocker-v1.schema.json","sha256":"b309f560c35cb8375edfc0fd3f602bc9ea4ae38118f39dd0de07fb7d54f1c4f5","size_bytes":2129},"config__schemas__stage17-q15-r-output-v3_schema_json":{"path":"config/schemas/stage17-q15-r-output-v3.schema.json","sha256":"ca6f02a0fdbb3da68d7a55abcdb2e00e1c0851c5384a18b1ba54d896ff5e86a8","size_bytes":2121},"config__schemas__stage17-q15-session-failure-v1_schema_json":{"path":"config/schemas/stage17-q15-session-failure-v1.schema.json","sha256":"8a56d5d6a220d83d26705500767ee8c9892ac1da47459209f3dcd1174b4fd4a5","size_bytes":2139},"config__schemas__stage17-q15-session-waiting-v1_schema_json":{"path":"config/schemas/stage17-q15-session-waiting-v1.schema.json","sha256":"51ac380398d49dfdc7bcd1752116cb664503f0aa054c782aa4393e3e83f4e7f3","size_bytes":807},"config__schemas__stage17-q15-w-output-v3_schema_json":{"path":"config/schemas/stage17-q15-w-output-v3.schema.json","sha256":"d398e9aa917c58a430c10278cc9e7e67724f880f835fe912c849939745338abd","size_bytes":1889},"config__schemas__stage17-q16a-output-v3_schema_json":{"path":"config/schemas/stage17-q16a-output-v3.schema.json","sha256":"32f392a5e7f648682eaf26d8af9523f1364f568c68820e8e81b42421cb333003","size_bytes":1626},"config__schemas__s